{
  "id": "conquest", "mapId": "canaan", "order": 30,
  "title": "進迦南", "years": "約主前 1406–1380 年",
  "desc": "摩西死後,約書亞率以色列人過約旦河,耶利哥城牆七日繞行後倒塌。大軍由中路楔入,南滅亞摩利五王聯軍,北破夏瑣為首的聯盟,迦南城邑次第易主。約書亞在示劍宣讀律法的祝福與咒詛,會幕設於示羅,各支派抽籤分地。然而迦南人未盡逐出,留下士師時代信仰動搖的伏筆。",
  "intro": "約書亞三路征服迦南,會幕立於示羅,應許之地分給十二支派。",
  "territory": [ { "faction": "united", "rect": [6, 12, 17, 26] } ],
  "routes": [ { "name": "征服路線", "color": "#e8c574", "points": ["jericho", "bethel", "shechem"] } ],
  "cities": ["jericho", "bethel", "shechem", "shiloh", "hebron"],
  "capitals": ["shiloh"],
  "people": [
    { "name": "約書亞", "tag": "統帥", "tagClass": "united", "desc": "摩西的接班人,領以色列人入迦南、主持分地的統帥", "avatar": { "skin": "#c89868", "hair": "#3a2a1a", "beard": "#3a2a1a", "robe": "#9b6fd1" } },
    { "name": "迦勒", "tag": "勇士", "tagClass": "united", "desc": "當年同報好信息的兩探子之一,85歲仍請戰奪希伯崙", "avatar": { "skin": "#c89868", "hair": "#888888", "beard": "#888888", "robe": "#7a4a3a" } },
    { "name": "喇合", "tag": "耶利哥人", "tagClass": "other", "desc": "耶利哥妓女,藏探子、繫朱紅線獲救,列入耶穌家譜", "avatar": { "skin": "#d8a878", "hair": "#1a0a0a", "robe": "#a83a5a" } }
  ],
  "events": [
    { "city": "jericho", "text": "以色列人繞城六日、第七日七次,祭司吹角、全民吶喊,耶利哥城牆崩塌。喇合一家因朱紅線記號獨存,全城歸為禁物。", "ref": "約書亞記 6" },
    { "city": "shechem", "text": "約書亞在基利心山與以巴路山之間,率全會眾宣讀律法的祝福與咒詛;晚年再於示劍立石為約:「至於我和我家,我們必定事奉耶和華。」", "ref": "約書亞記 8:30-35;24:15-27" },
    { "city": "shiloh", "text": "全地制服後,會幕遷設示羅,成為以色列的宗教中心。約書亞在此為尚未受地的七個支派抽籤分地,分地工作完成。", "ref": "約書亞記 18–19" }
  ],
  "books": ["約書亞記"]
}
