{
  "id": "creation", "mapId": "neareast", "order": 5,
  "title": "創世時代", "years": "太初 – 約主前 2000 年",
  "desc": "天地萬有由神的話語而出,人按神形像受造,卻在伊甸違命墮落,罪與死自此蔓延。該隱殺弟,世代敗壞,神以洪水潔淨大地,獨留挪亞一家,並立彩虹之約。人類又在示拿平原同心建巴別塔自高,神變亂口音,使萬族分散全地。然而在審判的陰影裡,神已悄悄預備呼召亞伯蘭的伏筆——救恩的線就此埋下。",
  "intro": "從創造到巴別,人類在受造的榮美與墮落的審判間,等候救贖的呼召。",
  "territory": [],
  "routes": [
    { "name": "出吾珥往哈蘭", "color": "#8fc3e8", "points": ["ur", "haran"] }
  ],
  "cities": ["ararat", "babylon", "nineveh", "ur", "haran"],
  "capitals": [],
  "people": [
    { "name": "亞當", "tag": "首造之人", "tagClass": "other", "desc": "神按自己形像所造的首人,因違命使罪與死進入世界", "avatar": { "skin": "#d8a878", "hair": "#3a2a1a", "beard": "#3a2a1a", "robe": "#7a8a55" } },
    { "name": "挪亞", "tag": "義人", "tagClass": "other", "desc": "當世唯一義人,造方舟存留人類與生靈,洪水後蒙神立約", "avatar": { "skin": "#c89868", "hair": "#cccccc", "beard": "#cccccc", "robe": "#5a7a9a" } },
    { "name": "寧錄", "tag": "獵戶", "tagClass": "other", "desc": "含的後裔,世上首位英勇獵戶,示拿與尼尼微諸城的奠基者", "avatar": { "skin": "#b08858", "hair": "#1a0a0a", "beard": "#1a0a0a", "robe": "#8a4a3a" } }
  ],
  "events": [
    { "city": "ararat", "text": "洪水消退,方舟停在亞拉臘山。挪亞獻祭,神立彩虹之約,應許不再以洪水滅絕全地。", "ref": "創世記 8:4;9:11-13" },
    { "city": "babylon", "text": "示拿平原的人同心築城建塔、要傳揚己名,神變亂他們的口音,使其分散全地,城名叫巴別。", "ref": "創世記 11:1-9" },
    { "city": "ur", "text": "他拉帶著亞伯蘭、撒萊與羅得離開迦勒底的吾珥,前往哈蘭定居,救贖的呼召即將臨到。", "ref": "創世記 11:31" }
  ],
  "books": ["創世記 1–11"]
}
